{
  "schema_version": "document-request-v1",
  "request_id": "decision-support-demo",
  "request_class": "decision_support_report",
  "requested_decision_posture": "review_support",
  "input_mode": "review_id",
  "request_summary": "Route an audited review package to the decision-support generator.",
  "inputs": {
    "review_id": "review-demo"
  }
}
